{
 "version": 3,
 "project": "并排多单元板式（一梯两户×2单元）",
 "site": {
  "lot_polygon_mm": [
   [
    0.0,
    0.0
   ],
   [
    44043.0,
    0.0
   ],
   [
    44043.0,
    16178.0
   ],
   [
    0.0,
    16178.0
   ]
  ],
  "origin": "lot_southwest",
  "north_deg": 0,
  "setbacks_mm": {
   "front": 0,
   "rear": 0,
   "left": 0,
   "right": 0
  }
 },
 "zones": [
  {
   "id": "std",
   "function": "residence",
   "floors": {
    "from": 1,
    "to": 1
   },
   "floor_height_mm": 3000,
   "outline_mm": [
    {
     "outer": {
      "vertices": [
       [
        0.0,
        724.0
       ],
       [
        6759.0,
        876.0
       ],
       [
        4062.0,
        1051.0
       ],
       [
        2351.0,
        2654.0
       ],
       [
        4519.0,
        8111.0
       ],
       [
        7494.0,
        8680.0
       ],
       [
        10545.0,
        5671.0
       ],
       [
        10729.0,
        2609.0
       ],
       [
        9146.0,
        963.0
       ],
       [
        12169.0,
        1074.0
       ],
       [
        10997.0,
        4751.0
       ],
       [
        13883.0,
        8586.0
       ],
       [
        17100.0,
        8225.0
       ],
       [
        19010.0,
        5681.0
       ],
       [
        19239.0,
        2299.0
       ],
       [
        13989.0,
        990.0
       ],
       [
        19284.0,
        0.0
       ],
       [
        27146.0,
        3817.0
       ],
       [
        42860.0,
        3523.0
       ],
       [
        44043.0,
        14665.0
       ],
       [
        42943.0,
        15681.0
       ],
       [
        29875.0,
        14868.0
       ],
       [
        24931.0,
        16178.0
       ],
       [
        22880.0,
        15680.0
       ],
       [
        20641.0,
        12700.0
       ],
       [
        17371.0,
        13174.0
       ],
       [
        13773.0,
        11868.0
       ],
       [
        1092.0,
        12711.0
       ]
      ],
      "arcs": []
     },
     "holes": [],
     "arcs": []
    }
   ],
   "program": [
    {
     "room": "unspecified"
    }
   ],
   "core": [
    {
     "vertices": [
      [
       9600.0,
       9200.0
      ],
      [
       12200.0,
       9200.0
      ],
      [
       12200.0,
       12700.0
      ],
      [
       9600.0,
       12700.0
      ]
     ],
     "arcs": []
    },
    {
     "vertices": [
      [
       31500.0,
       12700.0
      ],
      [
       34100.0,
       12700.0
      ],
      [
       34100.0,
       15200.0
      ],
      [
       31500.0,
       15200.0
      ]
     ],
     "arcs": []
    }
   ],
   "core_anchor_mm": [
    [
     10900,
     10950
    ],
    [
     32800,
     13950
    ]
   ],
   "typology_candidates": [
    "并排多单元双核心筒四户板式"
   ]
  }
 ],
 "design_rationale": "rings[0]四边分段：west(2v斜墙)+north(9v含核心筒凸出)+east(2v大切角)+south(19v含天井/阳台凹凸折)。轮廓从source.dxf WALL LINE提取(buffer400→close2000→simp800)；2个core矩形rings格式"
}
