{
 "version": 3,
 "project": "大型购物中心（Shopping Mall）：不规则轮廓+中庭+分散核心筒",
 "site": {
  "lot_polygon_mm": [
   [
    1110.7750072171468,
    0.0
   ],
   [
    195182.7577723746,
    0.0
   ],
   [
    195182.7577723746,
    185225.02613884374
   ],
   [
    1110.7750072171468,
    185225.02613884374
   ]
  ],
  "origin": "lot_southwest",
  "north_deg": 0,
  "setbacks_mm": {
   "front": 0,
   "rear": 0,
   "left": 0,
   "right": 0
  }
 },
 "zones": [
  {
   "id": "F1",
   "function": "retail",
   "floors": {
    "from": 1,
    "to": 1
   },
   "floor_height_mm": 3000,
   "outline_mm": [
    {
     "outer": {
      "vertices": [
       [
        1464.4916726521958,
        15064.407877305957
       ],
       [
        16564.44972560063,
        0.0
       ],
       [
        42109.18304387047,
        0.0
       ],
       [
        52205.888686485545,
        3872.064518960533
       ],
       [
        194300.0,
        131650.0
       ],
       [
        195182.7577723746,
        171116.628739915
       ],
       [
        181313.27938343264,
        185225.02613884374
       ],
       [
        25200.0,
        184400.0
       ],
       [
        14799.0,
        183400.0
       ],
       [
        4332.285976545178,
        172932.5219270508
       ],
       [
        1110.7750072171468,
        165128.70318812545
       ]
      ],
      "arcs": [
       {
        "at": 0,
        "center": [
         16564.44972560062,
         15099.999999999998
        ],
        "radius": 15100.0,
        "a0": -179.86494832432976,
        "a1": -89.99999999999997
       },
       {
        "at": 2,
        "center": [
         42109.18304387047,
         15100.0
        ],
        "radius": 15100.0,
        "a0": -90.0,
        "a1": -48.03658098204784
       },
       {
        "at": 5,
        "center": [
         181386.20848833228,
         171425.2188450567
        ],
        "radius": 13800.0,
        "a0": -1.2813322091682102,
        "a1": 90.30279343220963
       },
       {
        "at": 9,
        "center": [
         12110.74444976236,
         165154.6312245251
        ],
        "radius": 11000.0,
        "a0": 135.00209116316245,
        "a1": -179.86494832432967
       }
      ]
     },
     "holes": [
      {
       "vertices": [
        [
         50709.0,
         80172.0
        ],
        [
         50709.0,
         140172.0
        ],
        [
         110709.0,
         140172.0
        ],
        [
         110709.0,
         80172.0
        ]
       ],
       "arcs": []
      }
     ],
     "arcs": []
    }
   ],
   "program": [
    {
     "room": "unspecified"
    }
   ],
   "core": [
    {
     "vertices": [
      [
       20000.0,
       30000.0
      ],
      [
       40000.0,
       30000.0
      ],
      [
       40000.0,
       95000.0
      ],
      [
       20000.0,
       95000.0
      ]
     ],
     "arcs": []
    },
    {
     "vertices": [
      [
       140000.0,
       130000.0
      ],
      [
       160000.0,
       130000.0
      ],
      [
       160000.0,
       160000.0
      ],
      [
       140000.0,
       160000.0
      ]
     ],
     "arcs": []
    }
   ],
   "core_anchor_mm": [
    [
     30000,
     62500
    ],
    [
     150000,
     145000
    ]
   ],
   "typology_candidates": [
    "大型购物中心（不规则七边形+中庭+双核心筒）"
   ]
  }
 ],
 "design_rationale": "rings不规则七边折线 + 4×arc（幕墙圆角近似，source ARC r=15.1/13.8/11.0m）→ normalize 产出 plan.json ring.arcs 真弧。中庭hole + 双core。"
}
