{
 "version": 3,
 "project": "写字楼标准层（普通办公层）",
 "site": {
  "lot_polygon_mm": [
   [
    0.0,
    0.0
   ],
   [
    47465.0,
    0.0
   ],
   [
    47465.0,
    45995.0
   ],
   [
    0.0,
    45995.0
   ]
  ],
  "origin": "lot_southwest",
  "north_deg": 0,
  "setbacks_mm": {
   "front": 0,
   "rear": 0,
   "left": 0,
   "right": 0
  }
 },
 "zones": [
  {
   "id": "std",
   "function": "office",
   "floors": {
    "from": 1,
    "to": 1
   },
   "floor_height_mm": 3000,
   "outline_mm": [
    {
     "outer": {
      "vertices": [
       [
        0.0,
        0.0
       ],
       [
        47465.0,
        0.0
       ],
       [
        47465.0,
        45995.0
       ],
       [
        0.0,
        45995.0
       ]
      ],
      "arcs": []
     },
     "holes": [],
     "arcs": []
    }
   ],
   "program": [
    {
     "room": "unspecified"
    }
   ],
   "core": {
    "vertices": [
     [
      15400.0,
      14400.0
     ],
     [
      31997.0,
      14400.0
     ],
     [
      31997.0,
      31500.0
     ],
     [
      15400.0,
      31500.0
     ]
    ],
    "arcs": []
   },
   "core_anchor_mm": [
    23698,
    22950
   ],
   "typology_candidates": [
    "核心筒居中环廊"
   ]
  }
 ],
 "design_rationale": "rings四边矩形 47.5×46.0m（axis_grid）+ 居中核心筒 16.6×17.1m rings"
}
