{
 "version": 3,
 "project": "影院层变体",
 "site": {
  "lot_polygon_mm": [
   [
    0.0,
    0.0
   ],
   [
    260326.0,
    0.0
   ],
   [
    260326.0,
    107699.0
   ],
   [
    0.0,
    107699.0
   ]
  ],
  "origin": "lot_southwest",
  "north_deg": 0,
  "setbacks_mm": {
   "front": 0,
   "rear": 0,
   "left": 0,
   "right": 0
  }
 },
 "zones": [
  {
   "id": "F",
   "function": "retail",
   "floors": {
    "from": 1,
    "to": 1
   },
   "floor_height_mm": 3000,
   "outline_mm": [
    {
     "outer": {
      "vertices": [
       [
        24938.0,
        5650.0
       ],
       [
        49888.0,
        0.0
       ],
       [
        218588.0,
        200.0
       ],
       [
        245665.0,
        7200.0
       ],
       [
        260326.0,
        39533.0
       ],
       [
        225224.0,
        77457.0
       ],
       [
        113163.0,
        107699.0
       ],
       [
        61961.0,
        88522.0
       ],
       [
        2078.0,
        53248.0
       ],
       [
        0.0,
        43870.0
       ]
      ],
      "arcs": []
     },
     "holes": [],
     "arcs": []
    }
   ],
   "program": [
    {
     "room": "unspecified"
    }
   ],
   "core": [
    {
     "vertices": [
      [
       10000.0,
       30000.0
      ],
      [
       30000.0,
       30000.0
      ],
      [
       30000.0,
       70000.0
      ],
      [
       10000.0,
       70000.0
      ]
     ],
     "arcs": []
    },
    {
     "vertices": [
      [
       230000.0,
       30000.0
      ],
      [
       250000.0,
       30000.0
      ],
      [
       250000.0,
       70000.0
      ],
      [
       230000.0,
       70000.0
      ]
     ],
     "arcs": []
    }
   ],
   "core_anchor_mm": [
    [
     20000,
     50000
    ],
    [
     240000,
     50000
    ]
   ],
   "typology_candidates": [
    "影院层变体"
   ]
  }
 ],
 "design_rationale": "rings十顶点不规则折线（影院层外扩/切角）+ 双core同位。无中庭hole。"
}
