{
 "version": 3,
 "project": "双中庭长板式购物中心",
 "site": {
  "lot_polygon_mm": [
   [
    0.0,
    0.0
   ],
   [
    280563.0,
    0.0
   ],
   [
    280563.0,
    115031.0
   ],
   [
    0.0,
    115031.0
   ]
  ],
  "origin": "lot_southwest",
  "north_deg": 0,
  "setbacks_mm": {
   "front": 0,
   "rear": 0,
   "left": 0,
   "right": 0
  }
 },
 "zones": [
  {
   "id": "F",
   "function": "retail",
   "floors": {
    "from": 1,
    "to": 1
   },
   "floor_height_mm": 3000,
   "outline_mm": [
    {
     "outer": {
      "vertices": [
       [
        15556.0,
        5592.0
       ],
       [
        87025.0,
        0.0
       ],
       [
        232125.0,
        200.0
       ],
       [
        263618.0,
        5984.0
       ],
       [
        278496.0,
        20580.0
       ],
       [
        280563.0,
        68974.0
       ],
       [
        256969.0,
        81970.0
       ],
       [
        107999.0,
        115031.0
       ],
       [
        0.0,
        50793.0
       ]
      ],
      "arcs": []
     },
     "holes": [
      {
       "vertices": [
        [
         40000.0,
         33000.0
        ],
        [
         40000.0,
         63000.0
        ],
        [
         70000.0,
         63000.0
        ],
        [
         70000.0,
         33000.0
        ]
       ],
       "arcs": []
      },
      {
       "vertices": [
        [
         230000.0,
         37000.0
        ],
        [
         230000.0,
         67000.0
        ],
        [
         260000.0,
         67000.0
        ],
        [
         260000.0,
         37000.0
        ]
       ],
       "arcs": []
      }
     ],
     "arcs": []
    }
   ],
   "program": [
    {
     "room": "unspecified"
    }
   ],
   "core": [
    {
     "vertices": [
      [
       10000.0,
       30000.0
      ],
      [
       30000.0,
       30000.0
      ],
      [
       30000.0,
       70000.0
      ],
      [
       10000.0,
       70000.0
      ]
     ],
     "arcs": []
    },
    {
     "vertices": [
      [
       130000.0,
       45000.0
      ],
      [
       150000.0,
       45000.0
      ],
      [
       150000.0,
       65000.0
      ],
      [
       130000.0,
       65000.0
      ]
     ],
     "arcs": []
    },
    {
     "vertices": [
      [
       240000.0,
       30000.0
      ],
      [
       260000.0,
       30000.0
      ],
      [
       260000.0,
       70000.0
      ],
      [
       240000.0,
       70000.0
      ]
     ],
     "arcs": []
    }
   ],
   "core_anchor_mm": [
    [
     20000,
     50000
    ],
    [
     140000,
     55000
    ],
    [
     250000,
     50000
    ]
   ],
   "typology_candidates": [
    "双中庭长板式购物中心"
   ]
  }
 ],
 "design_rationale": "rings九顶点不规则折线+双中庭holes+三core。长边斜折表达轮廓曲线采样。"
}
